{
  "schema_version": "1.0.0",
  "manifest_id": "GATE-0-ENGINEERING-BASELINE-20260829",
  "gate_id": "G0",
  "decision": "hold",
  "created_at": "2026-08-29T00:00:00+12:00",
  "project_commit": "e02f567c48171da5fd5bc492e30ed1aaef2cbca1",
  "governing_plan_sha256": "22bb2f1ee7e727554c12bc0749db1c1d8a8ce45843ca7927359812e9b8a86ac0",
  "baseline": {
    "formulation_id": "vspd-v5.0.6-spd-formulation-v15-context",
    "source_commit": "21b1cf33f5607399331dcb1c03270348def5ccc8",
    "source_tree": "732a70e249f8727d4f2629c5a8f6b0090b78c0d0",
    "source_archive_sha256": "7bae337103ea0128b7e5b05887d3fac6525be032e5da59c49ee05a08eee0bce4",
    "data_profile": "pricing-gdx-versioned-v1",
    "solver_profiles": [
      "gams-cplex-oracle-deferred",
      "gams-scip-smoke",
      "gams-scip-highs-pricing",
      "highs-lp-only"
    ]
  },
  "environment_manifests": [
    {
      "id": "g1-scip-highs-pricing-runtime",
      "uri": "docs/gate-1/runtime-evidence.json",
      "sha256": "fd90d32dd04a2299cf54fd1d8c3f0c8c8856a6b1a68d66aec69423c4d8932eb3",
      "size_bytes": 4347,
      "media_type": "application/json"
    }
  ],
  "artifacts": [
    {
      "id": "governing-plan",
      "uri": "docs/pyomo-vspd-stage-gate-plan.md",
      "sha256": "22bb2f1ee7e727554c12bc0749db1c1d8a8ce45843ca7927359812e9b8a86ac0",
      "size_bytes": 107522,
      "media_type": "text/markdown"
    },
    {
      "id": "gate-0-index",
      "uri": "docs/gate-0/README.md",
      "sha256": "613b61224623aa016d9a3daf63972e5e91c1cd99ac10b06def1cac62db7a249d",
      "size_bytes": 5106,
      "media_type": "text/markdown"
    },
    {
      "id": "charter",
      "uri": "docs/gate-0/charter.md",
      "sha256": "3ed57e3c6853a6ce61c3b6ead1658a91d2be3bd6e8deaaf129e126f3fc1e528f",
      "size_bytes": 4086,
      "media_type": "text/markdown"
    },
    {
      "id": "compatibility-matrix",
      "uri": "docs/gate-0/compatibility-matrix.md",
      "sha256": "544825d27def19b1a9812bcc1ed97dafd88c7afcd43d94e1a1c9cd653ad1183c",
      "size_bytes": 5483,
      "media_type": "text/markdown"
    },
    {
      "id": "formulation-reconciliation",
      "uri": "docs/gate-0/formulation-reconciliation.md",
      "sha256": "bed521a12a49d2e2637c5821ab6e03d9c7be5b659065ad1cb4685f1bce33eb14",
      "size_bytes": 8687,
      "media_type": "text/markdown"
    },
    {
      "id": "gate-checklist",
      "uri": "docs/gate-0/gate-checklist.md",
      "sha256": "64f3755bd8dec7175d6b0c0dedd8e61bc21c4e156e924f21488698ad556227f2",
      "size_bytes": 5028,
      "media_type": "text/markdown"
    },
    {
      "id": "licence-provenance-register",
      "uri": "docs/gate-0/licence-and-provenance-register.md",
      "sha256": "4bef2823c479bd19f591f96bd3b924cfc428cf1e6b7c5efa9239f0a425635812",
      "size_bytes": 5160,
      "media_type": "text/markdown"
    },
    {
      "id": "risk-dependency-register",
      "uri": "docs/gate-0/risk-and-dependency-register.md",
      "sha256": "a2e4691d82953004b18f5b06afe034fb56ed651369c20b1695958a6851681d0e",
      "size_bytes": 5913,
      "media_type": "text/markdown"
    },
    {
      "id": "roles-signoff",
      "uri": "docs/gate-0/roles-and-signoff.md",
      "sha256": "b39c87a636db47d4fbbf86d36883c0af4ec1ac289d1f6e6ae31ce8fff45f8fd4",
      "size_bytes": 3048,
      "media_type": "text/markdown"
    },
    {
      "id": "gate-evidence-schema",
      "uri": "docs/gate-0/schemas/gate-evidence-manifest.schema.json",
      "sha256": "56357775c8a621964559bc80c7678fc152a7c88224f7d1518eed1e3abb842a1b",
      "size_bytes": 5207,
      "media_type": "application/json"
    },
    {
      "id": "tdd-evidence-schema",
      "uri": "docs/gate-0/schemas/tdd-evidence.schema.json",
      "sha256": "c0c51402855be0e240ae730386b0b2d83c219bce1760e7577c3b5d2873f972a6",
      "size_bytes": 5234,
      "media_type": "application/json"
    },
    {
      "id": "scope-feature-matrix",
      "uri": "docs/gate-0/scope-and-feature-matrix.md",
      "sha256": "bb7508513146791b3834156deca21d84a59a5ef27391e06f05837b359252aba7",
      "size_bytes": 6573,
      "media_type": "text/markdown"
    },
    {
      "id": "source-register",
      "uri": "docs/gate-0/source-register.json",
      "sha256": "5a5a5038473d5bf585c3b01132b49c257609623df0f6773f3ae616a9bf8a681b",
      "size_bytes": 5057,
      "media_type": "application/json"
    },
    {
      "id": "validation-baseline",
      "uri": "docs/gate-0/validation-baseline.md",
      "sha256": "f89569b899cf5acf7d2473fb7edce955f39d739fb93dad3596a3fd69bbdd044b",
      "size_bytes": 5889,
      "media_type": "text/markdown"
    },
    {
      "id": "adr-index",
      "uri": "docs/adr/README.md",
      "sha256": "8f6c299110e84c254a9ac1b0fafedf7e9dd33e3c581fbb1ee7df06f6300fd887",
      "size_bytes": 1706,
      "media_type": "text/markdown"
    },
    {
      "id": "adr-0001",
      "uri": "docs/adr/0001-formulation-baseline-and-versioning.md",
      "sha256": "17192d2e54822de4238da8791d71a431143b58f631e316957409f6c0338a1721",
      "size_bytes": 2933,
      "media_type": "text/markdown"
    },
    {
      "id": "adr-0002",
      "uri": "docs/adr/0002-class-based-pyomo-architecture.md",
      "sha256": "2fe880f6e1df33b752b9e7907fd6a68f1493b09cb84a97e1943132897dd913d1",
      "size_bytes": 3386,
      "media_type": "text/markdown"
    },
    {
      "id": "adr-0003",
      "uri": "docs/adr/0003-gdx-and-canonical-data-boundary.md",
      "sha256": "4a9d692f248cd8fb3f45f029a7d2972d731a095260a59a6aeb68d39c016c74b8",
      "size_bytes": 2813,
      "media_type": "text/markdown"
    },
    {
      "id": "adr-0004",
      "uri": "docs/adr/0004-solver-profiles-and-sos.md",
      "sha256": "66df2c3152d037518bb572b35a0bd3628d922262f6f25ed92865acb1511b1d1b",
      "size_bytes": 2990,
      "media_type": "text/markdown"
    },
    {
      "id": "adr-0005",
      "uri": "docs/adr/0005-oracle-and-evidence-retention.md",
      "sha256": "b986fc9b205c6d0a249f5e3ee66a2fd227ca1419492796ea06eabd002081033f",
      "size_bytes": 3009,
      "media_type": "text/markdown"
    },
    {
      "id": "adr-0006",
      "uri": "docs/adr/0006-pricing-convention.md",
      "sha256": "abe31afa2500c7fd5cbdde55833a2fa7df41103d7eeb899d0c415cfeac343495",
      "size_bytes": 3227,
      "media_type": "text/markdown"
    },
    {
      "id": "adr-0007",
      "uri": "docs/adr/0007-probity-tdd-evidence.md",
      "sha256": "99a52ab07f581f0a37903f5a2d630d3873531511413334e89fc1e6c458ff98d0",
      "size_bytes": 2780,
      "media_type": "text/markdown"
    },
    {
      "id": "adr-0008",
      "uri": "docs/adr/0008-interim-scip-highs-reference-profile.md",
      "sha256": "3ed3e28ac5f0ec42366e0f45b3aff7658c4392ef254f681816576cbe4b821c32",
      "size_bytes": 2876,
      "media_type": "text/markdown"
    }
  ],
  "test_reports": [],
  "discrepancies": [],
  "risks": [
    {
      "id": "R-002",
      "state": "g0-hold",
      "uri": "docs/gate-0/risk-and-dependency-register.md#risks"
    },
    {
      "id": "R-003",
      "state": "g0-hold",
      "uri": "docs/gate-0/risk-and-dependency-register.md#risks"
    },
    {
      "id": "R-017",
      "state": "g0-hold",
      "uri": "docs/gate-0/risk-and-dependency-register.md#risks"
    }
  ],
  "conditions": [
    {
      "id": "G0-C01",
      "description": "Gate 1 characterization may proceed, but no production formulation or release claim is authorized until named governance approvals close.",
      "owner": "Sponsor and gate authority",
      "due_at": "2026-09-30T17:00:00+13:00",
      "material": true
    },
    {
      "id": "G0-C02",
      "description": "Every active SCIP/HiGHS reference run must retain optimal status and pass canonical matrix and independent price validation; CPLEX is deferred cross-validation.",
      "owner": "Technical lead",
      "due_at": "2026-09-30T17:00:00+13:00",
      "material": true
    }
  ],
  "signatures": []
}
